0,من این لپ تاپ رو خریدم که باهاش کار تدوین فیلم انجام بدم ولی باید بگم که کلا لپ تاپ برای کارای تدوین اصلا بدرد نمیخوره حالا هر چقدر هم از سخت افزار خوبی برخوردار باشه اینو گفتم که گول اون کاربری مولتی مدیای که نوشته رو نخورید  ولی در کل لپ تاپ خوبیه متاسفانه برنامه ادیوس که یکی از نرم افزارهای تدوین فیلم هست روی این لپ تاپ عملکرد فوق العاده ضعیفی داشت من حتی بسختی میتونستم با فتوشاپ با این لپ تاپ کار کنم نمیخام بگم لپ تاپ بدی هست اما بدرد این کارهایی که گفتم نمیخوره با پول این لپ تاپ میتونید یه کیس خوب ببندید با قدرت خیلی بیشتر نسبت به قیمتش لپ تاپ خوبیه ولی بدرد کار من نخورد من تو استفاده از این برنامه ها از این لپ تاپ اصلا راضی نبودم یا علی 
0,برای خریدش ذوق داشتم و کاربران هم تعریف شو دادن خریدم ولی بد جور زد تو ذوقم از فرمت MKV پشتیبانی نمیکنه و باید رایت کنی رو DVD و نگاه کنی تنها بدیش همینه 
0,ابن لپ تاپ چون مناسب برای Game نیست بهتره انتظار زیادی نداشته باشید 
0,دستگاه خوبی هست ولی درایوسی دی نداره 
0,قیمت این لپ تاپ به نسبت امکاناتی که داره مقرون به صرفه است  سرعت پردازش هم نسبتاً بالاست  از خریدی که کردم راضی ام  
0,خیلی زود کف قابلمه کنده شد  با اینکه من فقط باهاش فرنی برای دخترم درست میکردم و اصلا قاشق کف اون نکشیده بودم  اصلا از تفال با گارانتی مادام العمر انتظار نداشتم   
0,وقتی روشن کردم دیدم تقریبا فقط 5یا6 گیگ فضا داره که بعد از یک آپدیت الان فقط 1 گیگ فضا داره آفیس 365 هم یک ماه رایگانه نه یک سال اصلا انتخاب خوبی نیست  
1,الان بدستم رسید کیفیتش خیلی خوبه ولی سنگینه اگه دو تا دسته داشت بهتر بود 
0,مرداد 96 در شگفت انگیز خریداری کردم   همونطور که نظرات بدرستی اشاره کردند در اولین استفاده   اولین استفاده   چرخ دنده پلاستیکی و بی کیفیت آن می شکند   دستگاه را بردم نمایندگی میرداماد قطعه را عوض کرد   اما محصول طوری از چشم افتاده که از آن تاریخ تا امروز دیگر از این دستگاه استفاده نشده است    قطعا با استفاده مجدد باز هم خواهد شکست    نمی دونم چطوری برندی مثل فیلیپس تن به ساخت چنین محصولی داده         
1,به درد کارهای عادی روزمره میخوره  که البته اگه بحواهید وبگردی کنید چشمتون اذیت میشه  در کل صفحه نمایشش افتضاحه  فیلم و   رو باید تو گوشی ببینی  اینجوری بهتر از این لپتاپه  زود داغ میکنه  در حدی که به پد لمسیش دست بزنی میسوزی  باتریشو باید دربیاری  لپتاپو بزنی به برق  شارژ نگه نمیداره  دو سه تا از دکمه های کیبوردش موقع تایپ ده انگشتی نمیگیره  اوایل که خریده بودم  کلی طول میکشید تا بالا بیاد ویندوز  نزدیک پنج دقیقه  از windows upgrade assistant که رو ویندوز نصب بود  ویندوزو آپدیت کردم  درست شد  فکر کنم همه رو گفتم دیگه  اگه میدونستم این جوریه نمیخریدم  شما هم نخرید 
1,پردازنده گرافیکی اش AMD Radeon R5 M430 هستش  
0,از لحاظ کیفیت  صفحه کیبورد و تاج بدترین لپ تابی که تا حالا دیدم الان 5 روز خریدم فقط روز اول ده دقیقه باهاش کار کردم انداختم گوشه خونه از شانس بد ما امروز هم جزو پیشنهاد شگفت انگیز شده صد تومن زیر قیمت میدن  
0,بعد یک سال کار کردن موتور خیلی داغ می کنه و بدنه هم یکم تغییر شکل داده بردم گارانتی میگه تغییر شکل بدنه و داغ کردن موتور طبیعیه بدنه مشمول گارانتی نمیشه  برای داغ نکردن موتور هم بعد ده دقیقه کار کنید و ده دقیقه صبر کنید تا خنک بشه 
0,سلام من یک ماهی میشه ابن محصول رو خریدم از دبجی کالا ولی درکل بگم خیلی صدا داره از موقع شروع تا اتمام کار یعنی از زمانی که پودر رو میریزید ودستگاه رو روشن میکنید تا موقع خاموش شدن صدای زیادی تولید میکنه مخصوصا ابکشی من که راضی نیستم به نظرمن لباسهاروهم تمیز نمیشوره 
0,بعد چند روز پوکید 
1,بدترین تبلتی که می تونین پیدا کنین  من هفت ماه پیش برای تولد پسرم خریدم  و با توجه به اینکه دو سال پیشش هم براش از همین برند ایسوس تبلت 7 اینچی گرفته بودم و در حد امکان ازش راضی بودیم   به این برند اعتماد کردم و خریدم  الان فوق العاده از خریدم ناراضی ام  تاچش خیلی خیلی بده  بجز اینکه خیلی مواقع هنگ می کنه و به کلی از کار میفته  وقتی هم که کار می کنه هرجا رو کلیک می کنی  بیشتر اوقات یکی دو سانت اونورترش پاسخ میده   یکی دیگه از ضعف هاش که غیر قابل قبوله مشکل نگهداری از کارت اس دی هست  دایم از درگاهش می پره بیرون و برنامه هایی که روشه هم بالطبع غیرفعال میشه 
1,اگر پوست صورت تون چربه و واقعا نمی دونید چکار کنید من این محصول رو پیشنهاد میدم واقعا پاک کننده خوبیه طروات خوبی هم به صورت تون میده 
1,اولا که رنگ این محصول صورتی رنگ نیست و بژ محسوب میشه و روی خود محصولم درج شده   نه خیلی روشنه نه تیره و برای پوست های گندمی مناسبه   این محصول اصلا برای پوست های چرب با منافذ باز مناسب نیست و منافذ رو واضح تر و برجسته تر نشون میده    خاصیت لیفت نداره و بعد یه مدت روی پوست صورت به اصطلاح میماسه  پوشش دهندگیش بد نیست ولی بازم جلوه ی مناسبی نداره حداقل برای پوست من  البته شاید اگه نسبت به قیمتش بهش نگاه شه انتخاب خوبی باشه نمیشه انتظار یه کرم پودر دویست هزار تومانیو ازش داشت ولی در صورتی که میخواین بخرینش یک کرم لیفت زیرسازی خوب همراه باهاش تهیه کنید   
0,من این لپ تاپ رو از دیجی کالا خریدم واقعا مضخرفه 
1,خیلی رقیقه  و اصلا کاور و پوشش دهی خوبی نداره  ولی رنگش برای پوستای روشن خوبه و خوب می شینه روی پوست 
1,سلام به دوستان عزیز این تی وی رو دیروز 23 تیر تحویل گرفتم و می خوام با سونی 4k عوضش کنم چون تا الان فقط از سونی استفاده میکردم و از کیفیت تصویر این تی وی راضی نیستم و قسمت های تیره تصاویر رو خوب نشون نمیده 
0,واقعا مزخرف 
1,برای کارای دمدستی خوبه 
1,کاملا طبیعه که این به نظر من نقطه قوتشه ولی  خیلی خیلی رقیقه 
1,کارائیش خوبه ولی این که برام فرستادن درش درست کیپ نمیشه و لاش باز میمونه و بخار ازش بیرون میزنه 
1,متاسفانه صدای فن بسیار آزاردهندس و اسپیکرهای لپ تاپ عملکرد مطلوبی ندارن  باید از هندزفری یا هدفون استفاده کنین 
1,این قالب امروز به دستم رسید عمق هر بخشش خیلی کم هست و به نظرم فقط به درد پای میخوره و برای مافین مناسب نیست  توی مشخصات کالا لازم هست که ارتفاع قالب ذکر بشه 
0,سلام من دوسال که دارم و از همین دیجی کالا خریدم من برای سبکی و قلم خریدم و خیلی با کارم اومد با اون قیمت ولی الان یه لب تاب دگ هم خریدم که کارای سنگین رو با اون انجام بدم همونطور که میدونید کارت گرافیک مجزا نداره و مطمئن بازی سنگین یا رندر گیری نمی تونید انجام بدید ولی با وضع فعلی ارز اصلا ارزش خرید نداره نسبت به قیمتش 
1,سلام نتیجه چند ماه مصرف این لپ تاپ رو براتون بطور خلاصه میگم    در حال حاضر  با ویندوز 10 تست شد است     کیبورد گاهی عمل نمیکند و مناسب کد نویسی و تایپ نیست  اگه در این دسته از ادم ها هستین کلا این لپ تاپ رو خط قرمز بزنین و دنبال یه لپ تاپ دیگ باشین  صفحه لمسی خیلی عالی کار میکنه  توقسمت تاچ پد مشکلی ندیدم  روش فقط بازی PES2016 نصب کردم ک مشکلی در اجرا نداشت و کار با برنامه های اتوکد و فتوشاپ بدون لگ اجرا میکنه صدای بلندگو هاش بلند هستن ک خیلی جوابگو هست نسبت ب بقیه لپ تاپ ها باتری با استفاده زیاد زودتر خالی میکنه ک میتونست باتری با درصد شارژدهی بالا بزارن جمع بندی  از پس برنامه های کاربردی ک من استفاده ردم اومده ولی بیشتر کیبردش اذیت میکنه ک گاهی عمل نمیکنه ک برای من بیشتر تایپ میکنم یه ضعف حساب میه ولی اگه زیاد اهل تایپ نیسین و نقاط ضعفیی ک براتون گفتم مهم نیس پیشنهاد میکنم بخرین  
1,رنگش خیلی تیره اس  ولی در کل کرم خوب و سبکیه پوشش متوسط و قابل قبولی داره ولی رنگ n4 رو  توصیه نمیکنم مگه اینکه پوستتون خیلی تیره باشه 
0,کیسه جارو به دلیل کوچک بودن به سرعت پر میشه و مکش جارو خیلی ضعیف میشه و سری های تبدیلش اصلا به درد نمیخوره کیفیت پایین پلاستیک استفاده شده در کل جارو هم که جای خود دارد  
0,کیفیت صدای خوبی داره ولی بزرگ ترین ایرادش نداشتن کنترل صداس   همیپ باعث میشه صدای بلندی رو نداشته باشه 
1,پوشش دهیش عالیه  ماندگاریشم روی پوست چرب خوبه طوری که بدون فیکساتور از صبح تا شب تقریبا ثابت میمونه  فقط اگه مدت طولانی قراره بمونه روی پوستتون   و پوستتون چربه  نباید دست بزنید بهش چون پاک میشه  
0,اتوی قوی هستش  اما در درجه پایین هم رو لباس برق میندازه  من حتی پارچه هم روی لباس انداختم  کف اتو هم ی مقدار کوچیکه   اما بخاردهی خوبی داره 
1,علاقه زیادی به اشپزی و خرید چاقوی اشپزی دارم  این واقعا عالیه کا زوتر اینو می خریدم اینهمه پول چاقو نمی دادم به جز گوشت  هرچی مثل سبزی پیاز و گوجه رو راحت می بره 
0,از نظر بنده به هیچ عنوان ارزش خرید رو نداره 
1,تو هفته اولی که ازش استفاده میکردم یکی از همکارام گفت چقد پوستت خوب شده   آخرای همون هفته اینو از دوستمم شنیدم بهش گفتم از این محصول استفاده میکنم شبش زنگ زد اسمشو بپرسه و یکی واسه خودش بخره 
1,سلام دوستان من اینو از نمایندگى سامسونگ گرفتم خیلی گرون تر سرمون کلاه گزاشتن سر شما کلاه نره ولى تلویزیون خودش عالیه 
1,دوربین را با این قیمت میشه با دوربین گوشی هم مقایسه کرد  باطریش هم ضعیفه   فقط جمع و جور و کوچیکه  کلا از خرید راضی نیستم  با این کیفیت نمی ارزید  
1,واسه پوست خشک مناسب نیست بعد از چند بار استفاده صورت رو پوسته پوسته میکنه ولی روی پوست چرب خواهرم خیلی خوب جواب داد  
0,که این هدفون گرفتم ظاهر خوبی داشت ولی جنس سیم وجک هدفون اصلا خوب نیست چون سیم از جکتا هدفون بهم چَسبیده وخیلی نازکه والان پس از 3ماه قطعی پیدا کرده اصلا هدفون های سیم ربانی نخرید پشیمون می شید 
1,من پوستم تقریبا سفیده ولی این کرمو که زدم شبیه روح شدم از بس که سفیده با یه پنکک که رنگش ی مقدار تن زرد داره رنگش بهتر شد  اگر پوستون گندمی و سبزه س به هیچ عنوان نخریدش شماره های تیره تر رو انتخاب کنید در مورد کیفیتشم باید بگم من خیلی راضیم چرب نیست و ی حالت مات و مخملی ب پوست میده   
0,دو روزه بدستم رسید اما خیلی کند بود و خراب پس فرستادم و بالاخره بعد دو هفته هزینه رو پس فرستادن بدون هزینه پست 
0,کیفیت بدنه پایین  کیفیت صفحه پایین  اجرا نکردن برنامه ها وپریدن به بیرون از برنامه  دوربین بی کیفیت  قیمت واقعا بالا نسبت به کارکرد 
1,امروز 4 روزه خریدم ولی هنوز بدستم نرسیده وقتی رسید دربارش نظرم رو میگم  
0,به پیروی از نظر دوست قبلیمون در کل صدای بدی نداری ولی برای موزیک دوستا یه چیز بگم داداش تا اینجا داری خرج میکنی یه کم بیشتر خرج کن یه مارک مربوط به صنعت صدا کا خوب جواب گرفته بین اطرافیانت بخر که بعدا پشیمون نشی من تودم jbl رو پیشنهاد می کنم داخل همین دیجی کالا هم هست اگر تموم نشده باشه کابلش تخت برند صنعت صدا و غیره و غیره 
1,خوشرنگ و معطر و با قیمت مناسب 
1,من دو روزه این هدفون رو گرفتم  صدا رو کاملا به بیرون انتقال میده مخصوصا وقتی صدا رو زیادش کنی  ولی در مقایسه با 3 هدفونی که توی همین رنج قیمت دارم و تست کردم صداش از همشون بهتر بود 
0,بسیار بد هست فکر میکردم بهتر باشه پیشنهاد نمیکنم  
1,رنگش برای من خوب بود و خوبم کاور کرد یکم زردی داره رنگبندیش ینی همه رنگاش ته مایه ی نخودی دارن  عطر داره ولی نمیمونه چند لحظه بعدش میپره بوش   پوست من نرماله نه چربه نه خشک ولی  یکی دوساعت بگذره برق میفته و بعد یه مدت استفاده کاملا پوستمو خشک کرد بنظرم مناسب استفاده تو فصل سرما اصلا نیست ولی برای تابستونای پوستای چرب خوبه   نظرتومهمه 
1,هدفون خوبی هست کیفیت ساختش بنظرم یکم ضعیف هست   ولی گوش رو اذیت نمیکنه  سیم بلندی داره ولی نازک هست اگر به خوبی نگهداری نشود احتمال هست زود از بین برود  پخش صدا و تفکیک صداش خوبه 
1,کیفیت صدای خوبی داره  طراحی زیبا گوش رو هم اصلا اذیت نمیکنه 
0,بی کیفیت در هر زمینه  
0,این دستگاه از نظر امکانات عالیه  تمام ابزارهای لازم رو داره  اما بازهم یه عیب بزرگ داره  اونم جوهرافشان بودنش هست  کارتریجش خیلی گرونه و بعد از یه مدت استفاده پشیمون میشی  در کل بنظرم پولتون رو پس انداز کنید و یه پرینتر لیزری بخرین  
1,راستی دستگاه سیستم عامل داره   یه توزیعی از لینوکس به نام Endless   سیستم عامل ظاهر ساده و خوبی داره   اما بعیده کسی نگهش داره   چون  کل هارد یک ترابایتی رو در اختیار گرفته و برای نصب ویندوز باید فرمتش کنی  از طرفی  quot لینوکس باز quot  هم که باشی احتمالا توزیعی رو نصب میکنی که کاربر  ایرانی و جهانی زیادی داشته باشه   برای نصب ویندوز  مجبور شدم توی تنظیمات Bios حالت دیسک رو از AHCI  به IDE  تغییر بدم   
1,من این رو از دیجی کالا گرفتم کیفیت بدنه خیلی خوب و شیک است اثر لک روی درب باقی نمیماند کیفیت دی وی دی درایو هم از ایسوس ها بهتر است ولی کیفیت صفحه نمایش با وجود fhd و ispزیاد دلچسب نیست  خوب است ولی عالی نیست من برای خانمم ایسرf5گرفتم البته گرانتر از این است ولی کیفیت صفحه ان هم که fhdاست از این بهتر است کیفیت صدا بسیار شفاف است ولی باس پایینی دارد و نیازمند اسپیکر اکسترنال برای صدای بلند میباشد ولی برای کارهای معمولی کارراه انداز است البته وزن خوبی دارد رقیبش یک سری ایسوس ها هستند که 1 9وزنشان است ک و باطری خوبی نسبت به ایسر f5 خانمم دارد یاعلی 
0,در هنگام استفاده از مولتی اسکرین برای کار با اینترنت و تماشای همزمان تلویزیون به محض کلیک کردن صدای تلویزیون قطع میشه در هنگام استفاده از هدفون به محض استفاده از دکمه افزایش صدا  صدا از اسپکر خود تلویزیون پخش میشه که برای دیگران آزار دهنده است به محض اتصال به اینترنت در حدود 2 گیگ اینترنت مصرف میکنه با وجود خاموش کردن تمام آپدیتها که این مورد حداقل هر چند روز یک بار تکرار میشه 
0,از مارک تفال انتظار بیشتری داشتیم کیفیت خیلی پایینی داشت به نحوی که تفلونش کامل از بین رفته و غذا میچسبه بهش اصلا راضی نیستیم 
1,متاسفانه بخارات غذا از لبه های ظرف بیرون می ریزه و اجاق و خود ظرف بعد از استفاده بسیار کثیف می شند  اگه می دونستم ساخت چینه هرگز نمی خریدمش   گول برندش رو خوردم  الان فرستادمش شرکتی که گارانتیش رو بعهده گرفته بود شاید تعمیر بشه   اگه درست نشه ازش نمیشه استفاده کرد  ممنون از دیجی کالا 
0,والا منافذ باز پوست من رو که اصلا کوچک نکرد که بعد از زدن کرم رنگی کمتر به چشم بیان فقط ماندگاری ارایشم رو برد بالا کاتریس ازین خیلی بهتره و چروکها و منافذ رو کم میکنه 
0,پوشش دهی و ماندگاری در حد یه ضد آفتاب معمولی هست و خیلی هم مات نیست چون زود محو میشه و انگار چیزی رو صورت نیست 
1,سلام این تجربه چند روزه منه این مدل لپ تاپ از پردازنده 2 هسته ای AMD استفاده میگنه که نسبت به اینتل ضعیف تره قیمت کمترش برای همینه نقاط ضعف و قوتشم نوشتم در کل نسبت به قیمتش برای کارای روزمره خوبه ولی برای بازی کردن ضعیفه  
1,من این اتو رو تو شگفت انگیز خریدم  هنوز استفاده نکردم  فقط یبار در حد 2ثانیه زدم به برق  فوری داغ شد  ظاهرا که اتوی خوبیه نسبت به قیمتش  برای من سبک بودن اتو مهم بود که کار کردن باهاش برام خسته کننده نباشه  
1,سلام من این لبتاب رو برای خواهرم چند روز پیش گرفتم قبل از این lenovo thinl pad e540 رو گرفته بودم که بخاطر مشکل LCD به دیجیکالا پس فرستادم و با این مدل عوض کردم نسبت به اون از کارت گرافیک ضعیف تری استفاده میکنه  netbookcheck   پردازنده بهتر از اون و روانتر کار میکنه  عمر باتری در حد قابل قبول هست و در حالت اتصال به وای فای و کار کردن و مرور اینترنت تا 3 الی 4 ساعت دوام میاره  در حالت گیم تا 1 5 ساعت که امری طبیعی هست  مشکل خیلی بدی که داره استعداد بسیار بالا در جذب لکه هستش که هم داخل و هم خارجش همینطوره و به راحتی پاک نمیشه  طراحی و دیزاین محصول خوبه ظخامت خیلی کمی داره و زیباست  کلیه درایور ها رو میشه با نرم افزار driver navigator دانلود و نصب کرد  پورت ها و اتصالات خوب و کافی هستن کیفیت صوتی خوبه ولی جای قرار گیری بلند گو نامناسبه  زیر لبتاب   صفحه نمایش خوب و روشنایی تصویر در حد قابل قبول  سرعت لود ویندوز هم خوبه  وزن دستگاه هر چند نسبت به رقبا یکم بالاتره ولی اداپتور خیلی کوچیک تری داره و این ضعف رو جبران کرده چون کسی که بخواد جابجا کنه باید مسلما اداپتور رو هم ببره  گارانتی دستگاه دو ساله هست برعکس بیشتر برند ها که یکسال گارانتی میکنن   البته کاری به شرایط گارانتی ایران ندارم   در کل برای استفاده دانشجویی یا اینترنتی و دیدن فیلمو و   لبتاب خوبی هست  برای گیم و کارهای سنگین توصیه بنده حداقل استفاده از مدل های با پردازنده و گرافیک قوی ترهست  یه مشکل خیلی بد هم پدر آدم درمیاد تا اولین بار ویندوز روش نصب کنه  
0,من این دستگاه رو دو روزه خریدم بهتون پیشنهاد میکنم از دستگاه های دیگیری استفاده کنید که حداقل برای استفاده اولیه با چندین چالش مواجه نباشید 
0,لوازم جانبی نیست برای این مدل  هر چند همون اول خاموش شد فرستادم گارانتی شد 
1,عالیی حتما بخرین  Digi kala ممنون بابت کالا های بسیار خوبت 
0,پرینتر سه کاره معمولی هستش و نسبت به قیمتی که میدید باید ازش انتظار داشته باشید 
