1,نظر قبلی خودم رو اصلاح میکنم کارتریج اصلش گیر نمیاد اما میشه براش مخزن یا کارتریج قابل شارژ تهیه کرد 
0,کارتریج مصرفی این پرینتر 17A هستش که خیلی گرونه و در صورت شارژ مجدد هم چیپست تنظیم تونر کار نمیکنه که کیفیت پرینت رو خیلی میاره پایین فعلا برای خرید پرینتر مناسبی نیست 
0,کارتریجش هیچ جا پیدا نمیشه 
0,یکم بیشتر پول بدید یه چیز بهتر بخرید  
0,این مدل  k456uf  توی دستگاه های ایسوس وجود خارجی نداره  این رو امروز بعد از ساعت ها جست و جو برای نصب درایور های جدید فهمیدم   حالا یا اشتباه از دیجیکالا و وارد کننده یا عمدی بوده و یا اینکه این مدل توی این منطقه به این اسم شناخته می شه اسم اصلی این مدل X456UF هست که یعنی کلا از سری K نیست و جز سری X حساب میشه   واقعا از دیجیکالا بعید بود   مشکل دیگه ای که توی این مدت مشاهده شد نبود فضای هایبرید هارد که ذکر شده 8 گیگابایت SSD داره هست و فقط یک ترابایت فضای دیسک معمولی دارید   البته اگه با جابجا بودن مدلی که می خرید مشکلی ندارید خیلی هم لپ تاپ خوبی هست  نسبت به قیمت هم امکانات بسیار مناسبی داره  
1,الان 9 ماهه دارمش لپ تاب خوبیه ولی از ایسوز انتظارم بیشتر بود آخه قبلا دل داشتم راسی ویندوز روش نصب نمیشد ک دیجی اومد ببردش و 10 نصب کرد ولی من 7 میخاسم نصب کنم ک بتز نشد ناچار بایوس لپ تاپ و آپدیت کردیم و کلی متن نصب ویندوز خوندم تا بعد از یک هفته نصبش کردم 
1,من حدود دو هفته س این مدل رو خریداری کردم  از کیفیت و رابط کاربری ش و کنترل راضیم  دوستانی که نسبت به کیفیت گله مند هستند لطفاً یک فیلم با کیفیت بالا رو با این تلویزیون ببینند نظرشون عوض میشه و از روی شبکه های معمولی داخلی کیفیت رو مورد قضاوت قرار ندهند  یه مشکلی که داشت و تونستم حلش کنم مشکل اتصال هدفون بود که با خرید  convertor digital to analog  و کابل optical مشکلش حل شد  نسبت به قیمتی که داره و تلویزیون های دیگه ارزش خریدش رو داره   شک نکنید   
1,مثل گج روی پوست میمونه 
1,من امروز سفارش دادم  حالا بدستم برسه نقاط قوت و ضعفشو کامل میگم 
0,جنس بدنه بسیار ضعیف دوربین بی کیفیت طراحی ضعیف بدنه ضمخت می باشد  
0,فوق العاده گوشی بی کیفیت هستش میکروفون و اسپیکر ضعییف کیفیت صغحه نمایش پایین باطری زود خالی میشه خیلی کنده 
0,سلام علیکم  من پول بیشتری دادم فیلیپس خریدم حالا پشیمونم چون هم تولید ملی نخریدم هم اینکه پولمو حروم کردم  ایکس ویژن امتحان خودشو پس داده   
0,من پوستم متمایل ب چربه اصلا ازاین کرم پودر راضی نبودم هم جوش ریز میزنم باهاش هم زود برق میندازه خیلی آبکیه و پوشش دهی  خیلی متوسطی داره کرم پودر لورال مات خیلییییی ازاین کرم پودر  بهتره  
0,در حالت بخار دهی مداوم و بخار لحظه ای قوی آب هم می پاشه فراوون   
1,پوشش دهیش همانطور که خودش هم گفته  نهایتا در حد متوسطه  اما بهترین ویژگی این محصول اینه که اصلاً روی پوست تابلو نیست بر خلاف بسیاری از پنکیک ها که از چند متری میشه پنکیک رو روی پوست تشخیص داد و حالت مصنوعی به صورت میدن   این پنکیک به کمک کرم پودر یه پوشش دهی متوسط و البته طبیعی میده 
1,دیجی باندای پایونیر همینطور ناموجود میشن لطفاااا زود زود موجود کنید 
1,سلام دوستان با توجه به اینکه 1 ماهی میشه من این لپ تاپ رو گرفتم خواستم چند مورد تجربیات خودم رو بازگو کنم اول از همه اینکه تنها تفاوتی که من بین این مدل و مدل 78J1 دیدم این هست که این مدل 70XR بلوری داره و اونیکی دی وی دی طی چند بخش توضیحات رو کامل میکنم هارد   سرعت خوبی داره دورش  7200 و تستی  که انجام دادم تا 160 170 mb هم سرعت خوندن داشتم که البته یه بخشیش بر ای بافرشه متوسط عملکردش نوشتنش رو 70 mb دیدم ssd   مهترین نکته ای رو که باید بهتون بگم در مورد این بخشه روی لپ تاپ من ssd توشیبا بود   روی خیلی مدلای دیگه ssd  مارک Liteon نصبه   البته مدل های جدید با گرافیک 1070  رو در سایت های مهم خبری دنیا دیدم که از همین مدل توشیبا استفاده شده و دیگه از  مدلهای مارک Liteon استفاده نمیشه سرعتی که با این مدل گرفتم  خواندن تا 545mb و نوشتن تا 483mb بر ثانیه بود  این مدل البته نوع m 2 و البته از نوع nvme نیست و یه خصوصیت خیلی خوبی که داره اینه که از هر دو کلید M و B  پشتیبانی میکنه   حالا چه فایده داره  فایدش اینه که میتونین این ssd رو رو اسلات بالایی 21110  نصب کنین   البته حتما باید قطعه نگه دارنده شو تهیه کنین چون طول این ssd  که از نوع 2280 هست 80میلی متر هست  وبرای نسب رو اسلات بالا ssd کلید B با طول 100 میلی متر نیاز دارین که تو بازار حداقل من ندیدم و خیلی کمه کسایی که دنبال عوض کردن ssd این دستگاه با انواع فوق پرسرعت مثل Samsung 950 pro nvme هستن باید عرض کنم که با اینکه اسلات M این لپتاپ این مدل رو ساپورت میکنه اما به دلیل ضعف بایاس ایسر این کار بسادگی انجام نمیشه و بصورت پیش فرض این مدل در بایاس دتکت نمیشه   و علاوه بر اینکه نسخه بایاس این لپ تاپ رو باید به نسخه 1 10 که آخرین انتشار این نسخه هست آپدیت کنین   یک سری تنظیمات خاص رو هم باید اعمال کنین تا از سرعت این نوع ssd لذت ببرین  صدا   کلیت صدای دستگاه قابل قبول بوده تا حالا گرافیک   در مورد گرافیک  980m  دیگه پرچمدار نیست ولی قابل قبوله سیستم خنک کننده   با توجه به اینکه کار من بیشتر سیستم های مجازی و لودینگ سنگین سیستم هست گرمای خیلی زیادی رو مشاهده نکردم البته صدای سیستم خنک کننده کم نیست رم   خیلی راحت قابل ارتقا  و حتی باس 2400 رو هم براحتی ساپورت میکنه گرچه سیستم بصورت اتوماتیک روی 2133 تنطیمش میکنه صفحه نمایش   این مدل رو خروجی G Sync رو ساپورت میکنه یعنی نمایشگر خودش این قابلیت رو نداره بلکه روی خروجی این قابلیت فعاله   البته مدلای جدید با گرافیک 1070 روی نمایشگر خود لپ تاپ این  ویژگی موجوده مطالب خیلی بیشتری هم بود که عنوان نکردم امیدوارم بددتون بخوره 
0,من یک تابه سفارش دادم که موقع تحویل متوجه شکستگی در دسته اون شدم بعد از پس دادن و گرفتن یه تابه دیگه از همون مدل این بار  متوجه شدم این یک از کنار ضربه خورده و بیضی هست  ظاهرا تموم این مدل تابه ها در موقع حمل و نقل دچار مشکل شده اند من دومی رو هم پس فرستادم و نتونستم پوشش نچسب اون رو امتحان کنم اما همین دوتا رو که دیدم از نظر دسته مشکل داشتند یعنی طراحی اون ایراد داشت  از اون مدل تابه ها هستند که دسته هاشون همیشه لق میزنند و شما نمیتو نید مثل آشپز های حرفه ای که تابه رو تکون میدن با اون کار کنید 
0,بزرگترین عیبش اینه که نمایشگر نداره و اصلا متوجه نمیشیم که دستگاه در چه وضعیتیه  خیلی جالبه    
1,به نظرم به قیمت اصلی گرونه   چون خیلی هم فوق العاده نیست  
0,من این پنکیک رو از دیجی کالا خریدم و برعکس همیشه از خریدم اصلا راضی نبودم  چون برعکس اون چیزی که توی نمونه رنگ هست خیلی خیلی رنگ روشنی داره و اصلا تیره نیست  
0,بی کیفیت مخصوصا دستگیرههای دوطرف قابلمه و درب قابلمه 
0,کلا فقط برای کارهای روزمره مناسب می باشد که البته در این رنج قیمت انتخاب های بهتری وجود دارد نتیجتا خرید این محصول را پیشنهاد نمیکنم 
1,من یکهفته است این دستگاه رو خریداری کردم و 3 بار استفاده کردم  باید بگم اون چیزی نیست که فکرش رو میکردم  پارچ مخلوط کنش درست روی دستگاه چفت نمیشه و لقی داره  آسیاب کنش هم درست مواد رو آسیاب نکرد  
1,تازه امروز رسید به دستم و بعد برسسیش حیفم اومد نظرى ندم محصول خیلى خوبیه تمام دى وى دى هاى فیلم منو با زیرنویس نشون میده و فایل هاى فرمت mk توى فلش من رو هم پخش میکنه و زیرنویسشم همونطورى که بقیه دوستان گفتن باید مثل اسم فیلم بکنید و اگرم ناخوانا پخش شد همون کارى کنید که دوستمون پایین تر گفتن چون براى من یکى دو زیرنویس اینطورى بود که بعد اون تغییر درست شد  موسیقى هم باهاش گوش کردم که خیلى خوب بود یک دستگاه همه چى تمومه براى کسایى مثل من که ارشیو بزرگى از فیلم دارن و فیلم زیاد میبینن 
1,نسبت به پولی که می دی اش می خوری دستگاه خوبیه 
0,کمتراز18ماه آی سی تغذیه یا هاردش سوخت نفهمیدنم چرا درستم نشد خاموش شد خودبه خود روشن خاموش میشد روی لوگو گیرمیکرد 
1,در کل بنظرم بهتره این رو نخرید و دنبال یه چیز با کیفیت تر باشید  
1,آقایونی که مثل من پوستی با چربی بسیار بالا دارن دنبال هیچ چیز دیگه نرن این خیلی عالیه امتحانش کنید من گه راضی ام نمونه اشم تو بازار نیست همین بهترین و تنها راه تمیز نگه داشتنه پوست صورت تونه حواس تون به پوست تون باشه یکی از اعضای بسیار مهمه بدنمونه 
1,من  با کاربری همسرم نظر میدم  باید بگم کیفیت خوبی داره  پوشش دهیش هم عالیه  من خودم راضی نبودم  چون مناسب پوست های سفید نیست  قشنگ روی پوست روشن تغییر رنگ مشخص میشه  کرم رنگه برای پوست های روشن من اسنس 09 پیشنهاد میکنم  که خود دیجی کالا عرضه میکنه 
0,گوشی خوبی نیست   حافظه فولدر سازی برای قسمت پیام اش کمه   موقع نوشتن پیام اذیت میکنه   راحت میشه هکش کرد   امنیت اش پایینه   تعداد لیست بلک لیست پیام و لیست رد تماسش کمه   
0,جهت مصارف خانگی خوب نیست بعد از یک ماه خراب شد با گارانتی درستش کردند و دوباره خراب شد بازهم با گارانتی درستش کردند و دست دوم فروختیم رفت  
0,کیفیت چاپ با کارتریج های اصلی خوبه  ولی هرگز به پای یک چاپگر مخصوص عکس اپسون نمیرسه هرگز  ولی با کارتریج شارژی میشه گفت افتضاحه پس باید همیشه از کارتریج اصلی استفاده کرد که مقرون به صرفه نیست  سیستم کاغذ کش هم احتمالا زود به مشکل بخوره چون کاغذ را باید رو به بالا بکشه وبرگدانه که میشه متصور بود بعد یه مدت از پس کاغذهای با گراماژ بالا برنیاد  اسکنر آن کیفیتش خوبه ولی جالبه هرگز به پای اسکنر چند کاره اپسون  RX500  که تکنولوژی ده سال قدیمی تری دراه نمیرسه  بسیار بزرگ وجاگیره هرگز برای یک عکاس مطلوب نیست ومقرون به صرفه نیست ولی برای امور خانگی ودفاتر اداری مطلوبه 
1,مشکل اساسی مادر برد دارد که خطای صفحه آبی میدهد و ریستارت می شود بعد از 6ماه تعویض قطعه شد 
0,کیفیت  ساخت هدفون خوبه ولی پخش صدا   ضعیف   نه برای موزیک و فیلم مناسب نیست    حتی یک مقدار هم باس نداره 
0,به نظر من فقط برای پوستهای نرمال و شاداب که لک یا جوش ندارن مناسبه پوشش و ماندگاری زیادی نداره اکثر دوستان نظر مثبتی داشتن و منم به همین دلیل خریدمش اما برای پوست من اصلا مناسب نیست 
0,سلام من این لپ تاب رو 875 خریدم که بعدا متوجه شدم واقعا بهتر از این هم با این قیمت میشد خرید گول برندش رو خوردم و بعدا متوجه شدم چینیه  و واقعا پشیمونم از این خرید 
0,با سلام خدمت دوستان بنده این تبلت رو حدودا دو ماه پیش خریدم و کمتر از یک ماه استفاده کردم و اولش خیلی عالی بود و کیفیت صدای بسیار خوب و به لحاظ سخت افزاری هم قابل قبول بود  اما بعد ا از حدودا یکماه موقعه استفاده از کاور صوتی همش ریست میشد اینم بگم که تو این یک ماه استفاده لبه های دستگاه دچار رنگ پریدگی شد و از طرفی استفاده از کاور صوتی دردسر های هم داشت نظیر جازدن و افزایش ضخامت و وزن بیشتر دستگاه خلاصه بعد از یکماه که به مشکل خورد بردم گارانتی سازگار اولش که گفتند تاریخ ضمانت گذشته و فاکتور دیجی کالا رو که دادم از تاریخ خرید با اکراه و هزار اما اگر ازم قبول کردند راستی این روهم بگم موقع استفاد از دستگاه  بدون کاور ظاهرا مشکی وجود نداشت و کارکرد دستگاه طبیعی بود  خلاصه از من قبول کردند و گفت حداقل 10 روز دیگه تماس بگیر  الان حدودا بیست روزه که پیگیری میکنم همش میگن سفارش قطعه زدیم تا بیاد باید صبر کنید  این هم شاید از شانس ما بود  خلاصه به نظر من تبلت ساده و بدون دنگ وفنگ و کاور صوتی و اینها بهتر است بگیرید ببخشید طولانی شد 
1,چند ماهی هست این محصول رو تهیه کردم  قدرت انچنانی نداره و لی کیفیت صداش خوبه  دنبال بیس قوی نبایستی باشید توی این محصول سیمش م خیلی نازکه ولی با کیفیت و خوبه ظاهر ش هم عالیه موفق باشید  
1,من این لپ تاپ رو تازه گرفتم   صفحه نمایش ضعیفی داره 
1,جنسش عالی و با کیفیته حیف ک طرحش زیاد قشنگ نیست ولی تو فت انگیز فوق العادس قیمتش جنس مرغوب فرانسوی نمیشه ازش ایرادی گرفت 
1,واقعا حیف شد پولم به قدری تو صدای بالا کیفیت پایینه که از شنیدن هر موسیفی زده میشم 
0,عالیه و بدرد بخور 
1,با سلام مجدد  دوستان بعد از تست پرینت از روی گوشی با مودم که براحتی انجام شد تست پرینت بدون مودم هم انجام دادم که اونم براحتی انجام شد  جالبه که حتی توی بازار فروشنده ها فکر میکردن که بدون مودم نمیشه با این پرینتر به صورت بیسیم پرینت گرفت  کاش میشد به دوستانی که مشکل دارن یه اموزش کوچیک داد تا کارشون راه بیوفته  
0,من دو ماه بعد خرید بشدت پشیمون شدم واقعا اعصابتون رو خورد میکنه الان 6 ماهه واسه فروش گذاشتم با 40  قیمیت کمتر هیشکی حاضر نیست اینو بگیره 
1,سلام من حدودا دو هفته است که این لپ تاپ رو از دیجی کالا خریدم چیزخوبیه فقط تنهامشکلی که داره اینه که بعدازیه مدت کوتاهی صدای خرخری آزارم میده صدای کمیه ولی احساس میکنم ازناحیه هارد دیسکش باشه مشکل دیگه ای نداره فقط این صدای خرخر ش بد جوری روی اعصابم راه میره  
0,من این هندز فری امروز به دستم رسید در مقایسه با هنز فری قبلیم pioner cl 701 کیفیت سیم افتضاح بیس افتضاح و کلا افتضاح پولمو دور ریختم 
1,من اینو بخاطر ظاهر نسبتا مناسب و تعدد پورتهاش خریدم  و فکر میکردم ویندوز سون هم روش نصب بشه ولی غیر از ویندوز 10 قبول نکرد   نکته مهمی که لازمه بدونید همراه لپ تاپ فقط شارژر هست و از  سی دی درایور  مربوطه که قاعدتا باید همراه بسته بندی باشد خبری نبود و بناچار از سایت اچ پی دانلود کردم   در کل به نسبت کارآیی که انتظار داشتم نبود   
0,تقریبا بیش از یکساله که این محصولو دارم و نسبتا راضی هستم ولی چتد مورد هست که لازم دیدم بهش اشاره کنم اول اینکه در طول این مدت چند ماهی ازش استفاده نکردم و نمیدونم چرا قدرت صداش کم و ضعیف شده و مثل اولش نیست علاوه بر این گوشی سمت راستش بیشتر دچار این نقص شده و بالانس صداییش رو از دست داد  الته نا گفته نماند که بعد از اینکه یه مدت استفاده کردم بهتر شده اما نمیدونم واقعا بهتر شده یا من عادت کردم در کل برای هدفی که ساخته شده طراحی مناسبی داره و سبک هستش اما توجه داشته باشید که ویژه اسپرت هستش و بخاطر  قسمت روی گوش نمیشه ازش به هنگام استراحت استفاده کرد  از لحاظ ضدآب بودن کاملا مطمعن هستش و خیلی وقتا بعد ورزش شستمش یا تو حموم استفاده کردم اما تو استخر نمیشه زیاد استفاده کرد چون ممکنه موقع شیرجه زدن در بیاد و مکافاتیه کش تنظیم کنندش بیشتر الکیه یعنی نیازی نیست بهش در کل فقط خریدش رو به کسایی توصیه می کنم که هنگام ورزش علاقه دارن به موسیقی گوش بدن اونم فقط پیاده روی و دو چون توی باشگاه اونقد صدا زیاد هست که با همه ی اینکه گوشیا صدای بیرونو حذف کنه بازم از لاله گوشتون صدا رد میشه و بهتره که با موزیک باشگاه هماهنگ بشید 
0,یکی از بدترین ارگونومی های موجود توی بازار  همون لحظه اول که گذاشتم تو گوشم پشیمون شدم از خریدش  اصلا توی گوش خوب جا نمیگیره ولی صداش خوبه 
0,حالا بهتون توضیح میدم که این مدل دارای هاله هایی اطراف پنل هستش سفید یا سیاه یعنی شما تصویر رو نگاه کنید میبینید یه هاله های مشکی یا سفید رو تصویر هستن که هیچوقت از بین نمیرن و بیشتر هم میشن بیشترین مشکله هاله رو این مدل داره تو ندل های سامسونگ  این ایراد رو هم افراد عادی سخت متوجه میشن یا اصلا شاید متوجه نشن  ولی بعد از چند وقت که گارانتیه محصول تموم شد هاله ها زیاد میشه و تصویر بد و بدتر و در نهایت باید تلویزیون رو عوض کنید چون گرونترین قسمت دستگاه پنلشه و دیگه بدرد نمیخوره  
0,خیلی هنگ میکنه  یه لپتاپ 4 هسته ای نباید  اینقدر کند باشه  
1,این کرم برای کسایی خوبه که پوستشون سفید یا گندمیه روشنه و اینکه خیلی رقیقه روی پوست سبکه و احساس سنگینی نمیده پوشش دهیش خیلی قوی نیست بعد 20دقیقه جذب پوست میشه و با رنگ اصلی پوست یکی میشه و به نظرم حتما باید صورت تمیز باشه و قبلش کرم مرطوب کننده استفاده بشه وگرنه کرم پودر تیکه تیکه روی صورت میشینه 
1,موبایل بسیار خوبی است 
0,تقریبا یکسالی داشتمش البته از  اولین تجربه های مایکروسافت بیشتر از این نمی شه انتظار داشت  شدیییییدا افسوس می خورم که زمانی که اینه خریدم با پولش می تونستم یک مک بوک ایر بی نظیر بگیرم که متاسفانه پولم رو هدر دادم  شخصا توصیه می کنم که اگر دنبال لپ تاپ هایی به این شکل هستید و همچنین اگر می خواهید همینقدر هزینه که به سراغ لپ تاپ های اپل بروید  من ترجیح دادم که اینو بفروشم و یک آیفون 6اس بهمراه یک لپ تاپ ویندوزی معمولی بگیرم تا زمانی که توانایی مالی خرید یک مک بوک رو پیدا کنم  
0,با سلام طراحی خوبی داره و خیلی ایمن هست  آب رو به سرعت جوش میاره و سوت خوبی هم داره ولی متاسفانه جنس زیاد جالبی نداره خصوصا ورق کف که به شدت نازک و شبیه حلبیه  خارهای داخل دسته بعد از 2 هفته استفاده شل شده بود و داشت خارج میشد که جا انداختم  امیدوارم حداقل تا یه سال قابل استفاده باقی بمونه  روی کتری براق هست  ترجیح میدادم مثل عکس مات باشه  ساخت کشور  چین 
