0,این لپ تاپو یک سال پیش گرفتم تا به حال دو بار بردش سوخته بعضی یو اس بی های لپ تاپ هم بعد یه مدت از کار افتاد ولی هربار بعد تعویض لپ تاپ درست شد من ازکلیاتش راضی هستم ولی از اینکه هی برد میسوزه  خیلی پشیمونم که گرفتم 
0,من این کابل رو یک ماه پیش از دیجی کالا خریدم ولی فقط دو هفته کارد کرد و کلا از کار افتاد 
1,با سلا م خدمت دوستان  مدت یکماه هست که این پرینتر را خریداری کردم  اولا از بابت طراحی و اندازه اش بگم که در نهایت ساده بودن  ولی خیلی شیک هست  خیلی آسان روس سیستم نصب شد  بلوتوسش عالیه  با برد بسیار خوب  سروصدا چاپش در مقایسه با مدلهای هم ردیفش کمتر و بهتره  خیلی واضح و تمیز چاپ میکنه   واقعا خانوادگی از خریدمون لذت بردیم  در آخر از تمام اعضای زحمتکش دیجی کالا ممنونم بخاطر نوع بسته بندی و احترامی که به خودشون و خریدار میگذارند  پاینده و سرافراز باشید  
0,مگنت ها به محض چسباندن به یخچال کنده شد و با چسب هم درست نشد 
1,کمی سنگین ولی مقاوم بزرگ ولی برای کار های ظریف هم میتوان استفاده کرد  
0,جاروی شارژی ک نتونه شارژ نگه داره واسه لای جرز خوبه   من ک پشیمونم   نخرید   
0,متاسفانه چینیه 
0,دوستمون گفته بود پوستش خشکه و شاید به همین علت پوشش دهی خوبی نداشته رو صورتش  من همین شماره رو گرفتم یه کم تم زرد داره ولی ابا اینه من پوستم معمولی و نسبتا چربا صلن روی پوست نمیخوابه کرمای ضد آفتاب معمولی رنگی ازین بهتر عمل میکنن  اگر به هوای کیفیت موسهاش میخرین اشتباه میکنین 
0,بسیار بد کیفیت از همون موقعی که اومده برام یکیش صداش خیلی کمه و انگار کلا سامسونگ اینطوره چون قبلش هم یکی اینطور گرفته بودم اصلا پیشنهاد نمیکنم 
0,با این کانفکیکت انتظار یک لپ تاپ قدرتمند رو داشتم اما اصلا اینطور نبود متاسفانه  
1,کیفیت ساخت بالایی داره تفکیک صداش خیلی خوبه اگر توقع بیس زیاد دارید  توقع شما رو برآورده نمی کنه 
1,من با کلی ذوق و شوق این ریموت رو خریدم  نصبش راحت بود و کمتر از 5 دقیقه وقت گرفت  اولش که نصب شد تست کردم و خوب کار میکرد  بعد چند روز استفاده تجربه من اینجوری بود  1  چند روز طول میکشه که بهش رو فرمون عادت کنین و توی پیچ ها مزاحم نشه  جای مناسبش رو روی فرمون بعد چند روز پیدا میکنین  2  دکمه پلی و پاوز نداره  باید صدا رو کم و زیاد کنین وقتی میخوایین آهنک رو قطع کنین یا باید با خود ضبط این کار رو بکنین  3  خیلی زود باطری خالی شد  شاید باطری اولیه خودش که توی بسته بندی بود کهنه بوده  4  بعد 2 3 هفته تسمه ها یکم خشک میشن و روی فرمون راه میوفته  شاید یه تیکه چسب دو طرفه زیر تسمه ها بتونه فیکسش کنه  5  در کل جای کنترل فابریکی ماشین های مدل بالا رو نمیگیره اما قشنگه و بهش عادت میکنین  
1,کلا لنوو ها کیفیت بدنه پایینی دارند این دستگاه کیبرد بی کیفیتی داره اصلا تایپ باهاش راحت نیست 
0,سلام   بنده به هیچ وجه خرید محصولات سخت افزاری از ماکروسافت رو به هیچکس پیشنهاد نمیدم  پس از مدتی خرابی های فراوان و عجیب و غریبی پیدا میکنن از جمله صدا دادن دستگاه موقع تاچ کردن  پرش تصویر   و برای بنده در نهایت سوختن مادربورد دستگاه که هزینه یک میلیون و چهارصدی و صرف زمان بسیار بهمراه داشت  اگر هم چنین ایراد هایی نداشته باشد توقع دستگاهی چندان کاربردی نداشته باشید چون نه مثل یک آیپد قابلیت های یک تبلت روان را دارد و نه توانایی لپ تاپ رو  تنها نکات مثبت اون صفحه نمایش به ظاهر خیره کننده و بلندگو های خوب میباشد  
1,واقعا بعیده از دیجی کالا که بعد 4 روز هنوز نفرستاده این کالا رو واسم هر روز یک پیام میاد و تازه بعد 4 روز فاکتور شده پیگیری هم میکنی میگن حتما تا فردا میفرستیم 
0,خریدش مناسب برای گوش دادن به موزیک نیست   
0,کیف و کاور و سایر وسایلش پیدا نمیشه برای 4راحتتر پیدا میشه و  گارانتی بد با پاسخگویی بدی  داره 
0,این کالا رو یک هفته است دارم استفاده میکنم کیفیت صداش افتضاح هست همکارم هدفون چینی خریده تست کردم صداش از این خیلی بهتره  ساختارشم طوری هست که تمام مدت استفاده گوش آدم درد میگیره به دی جی کالا گفتم میگه امکان مرجوعی نیست مثل کفش که میخری بعد یه مدت جا باز میکنه اینم جا باز میکنه فکر کردم به گوش من نمیخوره به همکارم هم دادم استفاده کرد همین مشکل رو داشت اگه خواستین این هدفون رو بخرین برید پولتونو بریزید دور حداقل احساس نمیکنید کلاه سرتون رفته 
0,با سلام وادب جنس روکشش بسیار بده وغدا با روغن هم می چسبه وقتی که با تابه پی اس دی ساخت ایران می توانستیم غدا بدون روغن درست کنیم وبیشتر از یک سال روکشش سالم ماند زمانی که خریدمش هیچ نظر نداشت وحواسم نبود که سایز دیگر داره واون نظرات منفی زیاد داره هرگز  روکش سرامیک نخرید  روکش تفلون وگرانیت خیلی بهتره 
1,تازه به دستم رسید  کیفیتش در حدی که میترسی روی سر بزاری بشکنه    شاید جنس موادش خوب باشه ولی اصلاً به شما این حس رو منتقل نمیکنه بیشتر شبیه یک محصول فیک است قاب دور گوشی ها از پلاستیک تو خالی ساخته شده بند روی سر از دو طرف به دو عدد کش وصل شده که اصلا جالب نیست  من از خریدش راضی نیستم با هزینه بیشتر محصول با کیفیت تر مثل زانهایزر بگیرید بهتره 
1,این مدل تحت لیسانس فرانسه در چین تولید شده 
0,اون دوست عزیزی که این تلویزیون را با ال جی مقایسه کرده همون بهتر که بره ال جی بخره کیفیت تصویر تلویزیونهای سامسونگ بر حسب ریتینگ جهانی خیلی خیلی بالاست این تلویزیون نسبت به قیمتش واقعا عالیه من سامسونگ 8880 دارم و پنج ساله که ازش استفاده میکنم تمام فکو فامیلی که ال جی یا برندهای دیگه داشتند با مقایسه کیفیت تصویر اعتراف به بهتر بودن سامسونگ داشتند تلویزیون من منوی تنظیم خیلی خیلی کاملی روی تلویزیون داره ولی نداشت هم نمیشد جزو معایب حسابش کرد چون اکثر دستگاهای صوتی تصویری دیجیتالی با کنترل از راه دور بهتر و کاملتر تنظیم میشن و منحصر به تلویزیون سامسونگ نیست در کل از دوستانی که نظراتشان باعث گمراهی خریداران میشه گله مندم  مقایسه حتما با توجه به قیمت باید انجام بشه و در یک سطح فقط یک مورد تخصصی در مورد تلویزیون سامسونگ بگم که رنگ سیاه در این تلویزیون واقعا روشن شدن پیکسلها به رنگ سیاهه نه خاموش شدن پیکسل برای نشان دادن رنگ سیاه  این مورد ریز باعث شده تلویزیونهای ال جی در نمایش تصاویر که در تاریکی و یا رنگ سیاه فیلمبرداری شده اند کیفیت پایینی داشته باشند که برای افراد حساس به کیفیت نکته قابل توجهیه  رنگ سیاه در ال جی خاکستریه یا سیاه رنگ پریده   پس سامسونگ از لحاظ کیفیت تصویر واقعا برتر از ال جی هست  
1,من این تبلت  از دیجی کالا در زمان تخفیف خرید گردم  مشخصا تبلت قدرتمند و باکیفیتی هست   فقط پشت قاب قسمت فلزی یک خط بسیار ریز بود و کناره ها تبلت کمی کثیف بود  امیدوار هستم تبلت آکبند تحویل شده باشد 
1,من این دستگاهو 2ماه پیش از دیجی کالا خریدم  درکل کیفیت مرقوب و ظاهر خوبی داره و استفاده ازش راضی کنندست تنها مشکلی که شاید هم عادی باشه و بین تمام این مدل زودپزها رایجه عملکرد دیر سوپاپ اطمینان و بسته شدن قفل سوپاپ برای جمع شدن بخار در زودپزه که باید در ابتدا شعله در حداکثر توان خودش باشه تا سریعا قفل شده و بخار جمع بشه در دستگاه 
1,کلمه Tefal برگرفته از ترکیب دو کلمه Teflon  و Aluminuum مى باشد و در تمام دنیا این برند رو براى ظروف تفلون میشناسند اگر چه در صنعت لوازم کوچک خانگى و آشپزخانه نیز وارد شده و بى شک موفق هم بوده اما تخصص اصلى اش ساخت ظروف آشپزى مى باشد هنگامى در بازار آمریکا به دنبال ظروف آشپزخانه باشید به راحتى متوجه تفاوت تفال با سایر برندهاى موجود و حتى با کیفیت اروپایى میشید و در آنصورته که بى هیچ شکى در اینجا تفال رو انتخاب میکنید  نیازى به آمریکا رفتن براى تایید این نظر نیست کافیه یه سرى به آمازون بزنید و احترامى که براى تفال وجود داره رو درک کنید گرچه سایر تکنولوژیها مثل استفاده از سرامیک میخواد با تفلون رقابت کنه اما شرکتهایى تراز اول همچون تفال با بالا بردن و بى ضرر کردن تکنولوژى تفلون خود و علیرغم تولید در سایر بخشها همچون سرامیکى   استیل   چدنى و  هنوز بیشترین فروش رو در ظرفهاى تفلون خود دارند و دریک کلام پر فروشترین ظرفهاى آشپزخانه کماکان تفلونها هستند و در راس آنها تفال قرار دارد البته دوستان فراموش نکنند براى خرید محصولات تفال حتما به وبسایت اصلى شرکت تفال مراجعه کنند و از تایید محصول مدنظر در سایت مطمئن بشند و بخاطر داشته باشیدمحصولات اصلى تفال جمله made in france را در زیر ظرف دارد  
1,درکل بد نیست 
1,جنسش چنان بی کیفیتی که انگار یه هدفون پنج هزار تومنی خریدم کیفیت صدا نسبت به قیمتش بد نیس اما متاسفانه بعد چند ماه استفاده از یکی از بلندگوهاش صدای خش خش خفیف میاد 
0,با سلام  نمیتونم بگم این لپ تاپ واقعا بده اما اون چیزی نیست که انتظار داشتم  ی مشکل خیلی بزرگ داره و اون این که سرعتش فوق العاده پایینه  مثلا برای باز کردن ی فایل و در زمان روشن شدن و کلا  اینقدر طول میکشه طول میکشه که ادم خسته میشه گاهی به خاطر همین موضوع هنگ هم میکنه  اما مشکل دیگری نداره  باطریش هم خوبه 
1,من این لب تا ب رو دقیقا پارسال برای همسرم گرفتم  ولی چند روز پیش خاموش شده و روشن نمیشه کار سنگین هم باهاش انجام نداد  در حد سرچ مقاله و تایپ و پاورپوینت فقط 
0,هندز فری خوش ساختیه و کیفیت ساخت خیلی خوبی داره اما به نسبت قیمتش کاری انجام نمیده  بر خلاف نظر دوستان من در محیط پر سرو صدا و محیز با صدای ثابت تست کردم قابلیت حذف نویز تقریبا کار نمی کنه می تونم بگم شاید 20 درصد از نویز محیط رو کم می کنه  ولی صدای بسیار بلندی داره و لی بخشی که باطری داره خیلی به کانکتور گوشی نزدیکه برای همین هی سنگینی می کنه  من این هندزفری رو با توجه به قیمتش توصیه نمی کنم  
1,پولی که میدید در برابر کیفیتی که دریافت میکنید هیچی نیست با خیال راحت بخریدش یه چربی ملایم خواستنی داره که باعث میشه چشمتون موقع پاک کردن اصلا اذیت نشه پاک کنندگیشم که حرف نداره برندشم که معروفه و  
1,با سلام  این ساندبار صدای شفاف و کاملا رضایت بخشی داره  بلندی و حجم صدا هم برای برگزاری یک جشن در منزل کفایت کننده است  در حالت تنظیمات پیش فرض دستگاه  بیس کمی بیش از حد زیاد و کوبنده ست که توصیه میشه با استفاده از تنظیمات  حداقل یک درجه کمتر بشه  در مجموع پخش بسیار دلچسب و گوشنوازی داره  
1,درود حدود دو سه ماهی است ازش استفاده میکنم  برای چاقوی دم دستی آشپزخانه کوچک که دوام خوب هم داشته باشد به نظر بنده عالیست ولی شاید قیمتش یه مقدار بالاست  با پیشنهاد شگفت انگیز احتمالاً قیمتش مناسب باشه  
0,من حدود یک ساله خریدم از دیجی کالا  وای فایش بعد از یه مدت از کار افتاده و کارتریجش رو شارژ نمیکنن و خیلی هم کارتریجش گرون در میاد و زود تموم میشه 
0,باسلام تلوزیون بسیار زیبا و کارامد برای جاهای کوچک و اتاق خواب ها توسیعه میکنم نصبت به برندهای دیگر با این قیمت واقا عالیه حتی اگر 1درصد تو فکرشین که بخریدش شک نکنین بهترینه من برای اتاق خوابم گرفتم بیشتر برای سرگرمی فوتبال دیدن و ps4بازی کردن عالیه فقط یک ضعف که داره اینه بعضی از فرمت ویدیویی ساپورت نمیکنه اونم اصلا جای نگرانی نداره بخرید مشیمان نمیشید        باتشکرازدیجی کالا  
1,لپ تاپ کار راه بنداز و معمولی ای هست و نباید ازش انتظار زیادی داشت  در کل جواب نیاز های روزمره آدم رو میده و میشه به عنوان لپ تاپ دانشجویی ازش استفاده کرد   کیفیت صفحه نمایشش میتونست بهتر باشه با این قیمت  صدا های درایو نوری هر چند ممکنه اذیت کنه گاهی اوقات اما طبیعی هست  بعد از دو سال استفاده  روزانه 4 5 ساعت  افت عملکرد یا بازدهی نداشته و دوام خوبی داشته  البته لپ تاپ محکمی نیست و باید در نگه داریش دقت کنید  
0,من دو سال پیش از دیجی برای مادرم خریدم چند وقت پیش شیار سیمکارت یکش قطع شد الانم شیار دومش  بردم برای تعمیر گفت ال جی اگه خراب شه دیگه کارش نمیشه کرد همونم شد و هرکاری کردیم درست نشد  اون زمان گوشی خوبی بود ولی الان با هرقیمتیم بدن نمیصرفه نخرید  
1,سلام وقت بخیر دوستان من این هدفون رو تحویل گرفتم از لحاظ ساختار ضعیفه و قابلیتی هم که نداره کیفیت صدا خوبه ولی صدا بیرون میره ازش و از بیرون واضح شتیده میشه نسبت به قیمتش خوبه ولی عالی نیستش برید بازار می توانید ارزانتر هم بخریدش به نظر من چیز دیگری بخرید برای حرفه ای موسیقی گوش دادن خوب نیست  
1,عالیه دیجى جون ممنون خیلى خوشرنگه و براى من که پوستم سفیده خیلى خوب و مناسبه  مى تونید گونه هاى برجسته و زیبایی داشته باشید بدون اینکه رنگش جلب توجه کنه و بد به نظر بیاد  برس همراهش اگر چه هلالى هست و کوچک ولى کار باهاش راحته و جالب  فقط من نمى دونم تاریخ انقضا تا چه زمانى هست چون وقتى کد 16 رقمى رو فرستادم اصلا جوابی دریافت نشد  
1,من به سفارش همسرم خرید کردم  به گفته ایشون و مشاهده خود بنده  کاملا با رنگ کاراملی موجود تو برندهای دیگه مثل اورآل متفاوته و بیشتر به کار دوستانی که میخوان برنزه کنن میاد  قبل خرید حتما امتحان کرده باشید  
1,نمایش بدید نظراتی رو که راجع به کیفیت محصولات مینویسیم 
1,من آنلاین بازی می کنم  ولی با لپ تاپ قدیمی خودم پینگ بهتری گیرم می یاد  اصلا از این لپ تاپ توقع این قدر لگ نداشتم  هر کی این مشکل داره بنویسه تا استفاده کنیم  ویندوز من 10  آنتی ویروس هم بیت دیفندر  
0,با سلام من مدتی که این آبمیوه گیری رو خریدم با توجه به قیمت ش و ظاهر زیبا  و نظرات کاربران انتخاب کردم اما واقعیتش اینه که خوب آب میوه رو نمیگیره   
0,این پرینتر را خریدم و   اصلا راضی نیستم  پیشنهاد می کنم لیزری بخرید  
1,رنگ پوست من کلا روشنه ولی این رنگ کرم پودر چندین درجه از منی که سفیدم روشن تر بود   پوشش دهی و ماندگاری عالی داره برای پوست چرب من بعد از 12 ساعت پوستم برق نیوفتاد ولی اگر این رنگ رو انتخاب کنین به تنهایی قابل استفاده نیست باید با یه رنگ تیره مخلوطش کنین تا بشه استفاده کرد   
0,به درد نخور لپ تاپ دنیا 
1,به نسبت قیمت و عملکردی که از لپ تاپم میخواستم  درس خوندن و گاهی فیلم دیدن  تا این لحظه خوب بوده باید ببینید از لپتاپتون چی میخواید  
0,درج شده بود کیف و موس اوریجینال ایسوس با لبتا   هست ولی کیف نیست و کوله   شتی میباشد با جنس نامرغوب و نیز دی وی دی همراه برای مدل A541UJ  میباشد صفحه نمایش غیر مات که سبب درد چشم می شود 
0,اصلا کیفیت نداشت فک میکردم چون سونیه عالیه  بزارید یه چیزیو بهتون بگم  این هدفون جوریه که بورای شنیدن صدا ازش حتما باید پایه بیسیمشو بزنی برق و بعد وصل کنی به اون چیزی که ازش میخوای صدا بگیری درغیر اینصورت حتی با کابل هم به گوشی وص نمیشه  به کارتون نمیاد منم که خریدم میخوام که بفروشمش این اشتباهی که من کردمو نکنید 
0,من این هدفون رو خریدم و فکر میکردم صورتیش خیلی دخترونه نباشه اما هست  موقع استفاده واقعا سبک هست و تو گوش خیلی راحت هست اما سیم و بقیه اجزا اذیتت میکنه  کیفیت صداشم معمولی هست و جدا سازی صداش هم اگه منظور این باشه که صدای ویولون و ساز دهنی و خواننده رو جدا میکنه اره خیلی شفاف هست تکنیکی نمیدونم جداسازی میکنه یا نه  در کل به نظرم نصف این قیمت تو بازار بتونید هندزفری های بهتری هم پیدا کنید  
1,اول اینکه اگه یکم تو تکنولوژی اطلاعات داشتی نمیومدی  بهترین کنسول بازیا با یه لپ تاپ مقایسه کنی در صورتی که من لپ تاپ را از همین دیجی کالا گرفتم و تا حالا کوچگترین لگی نداده کارت گرافیکش هم نسبت به همه لپ تاپ های هم رده خودش بالا تره در ضمن اسم بازی سنگین میاریم که بگیم سنگین ترین بازی هارو اجرا میکنه بدون هیچ لگ مثل gta vو حالا حالا ها هم قرار نیست قدیمی بشه 
0,در کل باتوجه به کاستی هایی که داره خب میشه ازش راضی بود حداقل از مارک های موجود در بازار که قبلا واقعا عالی بودن ولی الان خیلی کیفیت پایینی دارن باتوجه به رنج قیمتیش تلویزیون خوبیه  تصویر باکیفیت و شفافی ارایه میده یه جورایی حالت هوشمندش ضعیفه 
1,سلام انتظار بیشتری از این محصول داشتم و کرم پودر اکتی پور رو در بعضی موارد بهتر از اون دیدم  پوشش و کاورش متوسط هست و برای پوست هایی که جوش و لک زیادی دارند اصلن مناسب نیست  کرم سبکی هست و من بعد از استفاده ازش احساس سنگینی رو صورتم نداشتم  متاسفانه این رنگ اصلن مناسب پوست من نبود و من باید چند شماره ای روشنتر می گرفتم  این رنگ  می تونه رنگ رژگونه یا سایه چشم من باشه  نه رنگ پوست من  وقتی این کرم رو می زنم انگار برنزه کردم  
0,واقعا پشیمونم از خریدم اصلا نه صدای خوبی داره نه بیسه خوب خیلی بد خورد تو ذوقم کاش امکانش بود بشه پس داد اصلا پیشنهاد نمیکنم 
0,بعد از یک ماه استفاده خیلی بی دلیل صدای یکی از گوشی ها حدودا یک دهم حالت عادی شد  روی گوش خوب می ایسته اما واقعا خیلی توی ذوق خورد که انقد بیخودی خراب شد   128528  
1,لپ تاپ بدی نیست یه ذره زاویه دید پایینی داره   جای اثر انگشت خیلی میمونه و کلیکهای تاچ پد خوب عمل نمیکنه  
0,از نظر ظاهری جالب نیست  جنس بدنه پایینه  نداشتن دی وی دی رام  نداشتن کیف و موس   در مقایسه با سایر رقبا در این رنج قیمت بخصوص ایسوز   خیلی عقبه    در کل این لپ تاپ در مقایسه با قیمتش اصلا ارزش خرید نداره   
0,با نظر قبلی کاملا موافقم خیلیی محصولات دیگه ایی هستن که با قیمت پایین تر  جلوه ی خیلی بیشتری روی پوست دارن اما این محصول   واقعا این انتظار رو نداشتم 
