1,در مورد این لپ تاپ باید بگم فقط 1پورت USB2 داره و 3تا هم USB3 دیگه اینکه هرچند جنس بدنه مات هست ولی اثر دست روی لب تاب میمونه  باتری برای من تحت استفاده مداوم و شدید  نصب نرم افزارها و کپی دیتاها و گوش کردن آهنگ و    حدود 2ساعت جواب داد  از نظر گرم شدن و صدای فن هم در مقایسه با بقیه لب تاب ها بهتره  تو این رده قیمتی به نظر من مناسب ترینه و تمام هزینه ای که میکنین برای قدرت کارایی اون هستش ظاهرش هم خوبه ولی کیفیت ساختش کمی پایینه ولی در عوض نسبت به پولی که میدین بالاترین عملکرد رو داره  همونطور که دوستان هم اشاره کردن درایور هاشو باید از سایت lenovo بگیرین همین الان هم بگم که حجم بعضی درایور هاش ممکنه 300تا 500مگ هم برسه  گرافیک مثلا  و تعدادی نرم افزار های کمکی دیگه هم هست  بخش دوم  الان که دارم بخش دوم رو مینویسم حدود1سال از زمان خریدم گذشته و طی این مدت هم تجربیاتی رو داشتم که بهتر دیدم با شماها هم در میون بذارم اول اینکه بعد از مدتی حدود7 8ماه usb3 لپ تاپ از کار افتاد و هر کاری هم کردم از جمله تعویض ویندوز و آپدیت درایور ها و غیره هم فایده ای نداشت احتمالا مشکل سخت افزاریه ولی usb2 همچنان نصفه نیمه کار میکنه دوم مشکل هارد دستگاهه که بعد از یه مدت کار نه خیلی سنگین کلا هنگ میکنه و فریز میشه و گه گاه صداهای جیر جیر میده از خودش و سوم اینکه جدیدا حدود 3ماه پیش دوربین وبکمش هم از کار افتاد و تصویر کاملا گنگ با رنگ های پخش نشون میده که نتونستم بفهمم چشه و باز هم با تعویض ویندوز و درایورها و آپدیت کردنشون هم درست نشد در حال حاضر نمیتونم برای خریدش به شما توصیه ای داشته باشم به هرحال خرابی هم برای وسیلست دیگه و ممکنه فقط این تجربیات برای من پیش اومده باشه و سایر دوستان راضی باشن ازش  دیگه تصمیم گیری و قضاوت با توجه به نظرات و گفته های همه دوستان با خودتون 
0,دوستان دقت داشته باشید با هر ضبطی کار نمیکنه من به ضبط ماشینم وصل کردم ضبط erorr داد و کار نکرد 
1,من امروز سفارش دادم وقتی رسید دستم نظرمو بطور دقیق میگم بهتون  
0,وقتی درجعبه روبازکردم دیدم قوری وکتری ست نیس خیلی حالم گرفته شدوخیلی ناراحت شدم دیجی کالامگه نبایدکتری وقوری رنگش ست باشه ولی برامن نبود 
0,بافت بسیار خوب و پوشش دهی مناسب 
0,من هتوز با خود دستگاه کار نکردم ولی این دستگاه با مدل مشابه ش که 068 از نظر رنگ و کیفیت بدنه خیلی متفاوت هست پیشنهاد میکنم 068 رو بگیرید 
0,اسکرین سیور قابل آپدیت داره با کیفیت بی نظیر  طراحی ریموت که مجهز به ژیروسکوپ کاملا حرفه ای هست همراه با تاچ پد  کیفیت تصویر بینظیره  سینک عالی و راحت گوشی و اپل آی دی  در کل به شدت توصیه میکنم چون بسیار حرفه ایه  
1,ایسوز بهترین مارک لپ ناپه اونم ایسوز دیجی کالا با باتری های اصلی فقط دیجی جون زیاد هوای مشتری هاش رو نداره  
1,امروزه برند های مختلف در حوزه های مختلف با یکدیگر به رقابت می پردازند رقابتی که باعث شده هر برند طرفداران خود را نیز پیدا کرده باشد افرادی که تحت هر شرایط نقاط قوت محصول تولیدی برند مورد علاقه خودشون رو خیلی بیشتر از نقاط ضعف اون می بینن و بهشون توجه میکنن و همونا رو معیار برتری به سایر برند ها میدونن  در مورد کنسول بازی هم قاعدتا همین شرایط صدق می کنه و دو قول تکنولوژی یعنی سونی و مایکروسافت  اقدام به تولید کنسول های بازی خودشون می کنن و هر کدوم از این دو کمپانی طرفدارای پر و پا قرص خودشون رو دارن  اما نکته اینجاست که به هنگام خرید یه کنسول بازی چه چیزی رو باید ملاک قرار داد  کیفیت ساخت و عملکرد    پشتیبانی و کارایی    تعصب روی کمپانی سازنده اون  خب قاعدتا با نگاه به موارد بالا میشه متوجه شد که از دید منطقی باید واقعا کنسولی رو انتخاب کنیم که اولا بتونه نیاز های ما رو برآورده کنه و همچنین کیفیت بالایی داشته باشه من خودم شخصا از طرفداران کنسول ایکس باکس بودم و به هنگام تصمیم گیری بدون فکر کزد به محصول کمپانی رقیپ یعنی پی اس 4 رفتن سراغ ایکس باکس وان باندل فیفا 17 و از اونجایی که خرید از دیجی کالا جدای از راحتی و حس امنیتی که داشت آسون بود و میدونستم بدون دردسر دود و ترافیک جنس اورجینال سریع و با قیمت عالی به دستم میرسه  کنسول ایکس باکس وان ا  نظر کیفیت ساخت   پشتیبانی از تصویر 4کی  البته به شرطی که نمایشگرتون این قابلیت رو داشته باشه   و همچنین پشتیبانی از بلوری و بازی های انحصاری بی مظیر مثل فورزا بی نظیره و اینا هر گیمری رو جذب می کنه مهمتر ار اینه اینکه به نظر من کنترلر فوق العاده راحت تر  و با کیفیت تری داره نسبت به پی اس 4 ولی یه نکته ی خیلی مهم هست که کار رو سخت می کنه کم بودن شدید افرادی که تو ایران از این کنسول استفاده میکنن بزرگترین و تلخ ترین دغدغه شما بعد از خرید این کنسول خواهد بود  شاید الان با خودتون بگین که این چه تاثیری داره ولی این دقیقا همون نکته ای هست که شاید بعد از گذشت 2 ماه باعث بشه یهو به خودتون بگین جایی هست که ایکس باکسم رو ببرم و با پی اس 4 عوضش کنم  شاید اینجا اولین جایی باشه که تنها چیزی که از تعصب روی برند مورد علاقتون براتون میمونه حس تردید و سردرگمی باشه  و اما چرا  کنسولی که تو ایران کم استفاده بشه به طبع بازی هاش سخت گیر میاد این کنسول بازی هاش با قطمت بالاتر تو بازار خواهد بود چنین کنسولی به طبع تعمیر کاران کمتری رو در حوضه خودش داره  تعویض بازی خیلی سخت ممکنه انجام بشه بین افراد وقتی تعدادشون کم باشه تعداد دوستان و ایرانی های کم تو ایکس باکس لایو و بسیاری موارد دیگه که ریشه ی همه اونها تو کم بودن تعداد افرادی هست که تو ایران از کنسول ایکس باکس وان استفاده می کنن  در کلام آخر باید بگم باید از جامون بلند شیم و به افتخار مایکروسافت برای تولید چنین کنسولی با این همه قابلیت دست بزنیم به کنسول خیره شیم و از طراحی زیبای اون لذت ببریم خوشحال باشم از اینکه تو دوره ای زندگی می کنیم که تکنولوژی تا این حد پیشرفت کرده ولی موقع خرید از خودمون یک سوال ساده بپرسیم آیا این کنسول مناسب ایران هست  
0,دوستان در خریدش شک نکنید اندازه کوچک و قدرت بالا عالیه 
0,در کل نسبت به قیمت و پردازنده ضعیف و کیفیت پایین صفحه نمایش و باتری ضعیف ارزش خریدن نداره 
0,من یک روز بعد از تحویل این لپ تاپ با مشکل عدم کارکرد درست سی دی رام مواجه شدم که 99  سی دی ها را نمی خوند و خود به خود ریجکتشون می کرد فقط تعداد کمی از سی دی و دید وی دی ها را می خوند  بسیار لکه می گیرد که اعصاب آدم را خورد می کند 
0,با ی ضربه کوچک پنلش شکست   واقعا quot  ضعیفه 
1,چیزی که عجیب بود اینه که سطح مقطعش کاملا دایره نیست  انگار ضربه خورده و تورفتگی پیدا کرده  برای همین دربش با یه فشار کوچولو بسته میشه   تقریبا همزمان با این  یه تابه زرساب 28 سانتی خریدم  فکر میکردم ایرانیه و کیفیتش باید پایینتر از تقال باشه  اما نظرم کاملا تغییر کرد  انتظار این فرورفتگی را روی بدنه تفال نداشتم  دفعه بعد حتما زرساب میخرم  حداقل  قیمتش یک دوم قیمت مدل prima تفاله  نسبت به بقیه مدلهای تفالم که خیلی ارزونتره  ضمنا کیفیتشم واقعا خوبه   حتی از این مدل تفال بالاتره  اینو در مقایسه دوتا محصول دیدم  
1,البته به اندازه پولی که میدی باید انتظار داشته باشی  من تو پیشنهاد ویژه خریدم و با اون قیمت خوبه 
0,من خریدم الان بعد 3 ماه هدش خراب شده هیچ جا گیر نمیاد شرکت گارانتی کننده هم پول یک دستگاه نو را میخواد برای تعویض هد  واقعا ناامید کننده هست 
0,تو یه کلمه داغ میکنه زیاد  دست رو میسوزونه عملا یه تومن پول رو دور ریختم با خریدم 
0,اصلا بهتون پیشنهاد نمیکنم  همین که از BIOS پشتیبانی نمیکنه  دهن منو سرویس کرده  سیستم عامل کم روش نصب میشه  نصب میشه اجرا نمیشه    خیلی درد سر داره   از خرید این لپتاپ پشیمون میشید  
1,اولا تشکر میکنم از دیجیکالا بابت بسته بندی عالی و شیک این لبتابو از دیجی پریروز تحویل گرفتم که خیلی سبک و در عین حال شکیل و امروزی هست فقط پشت لبتاب یه تکه هست و باطری قابل تعویض نداره و باطریش داخلی هست در کل با توجه به قیمت و مشخصات فنیش خوبه و از خریدم راضی هستم 
1,سرعت بالا اومدن ویندوز نسبت به قطعاتش پایینه ولی از نظر قدرت عالی عمل میکنه 
0,من شهریور ماه 96 این لپ تاپ رو از دیجیکالا خریدم از شانس بدم مشکل auto power off داشت  یعنی خاموش شدن بدون دلیل   این مشکل به علت قطعات نامرغوب ایجاد میشه    گارانتی لپ تاپ آواژنگ بود  الان که این مطلب رو می نویسم دو هفته است که دادمش به آواژنگ برای حل مشکل  ولی خبری نشده و پیگیری هم میکنم میگند تو فرایند تعمیر است    از خرید این لپ تاپ واقعا پشیمونم و به همه توصیه میکنم اصلا سمت ASUS نرند  دیگه هم بعید می دونم که از دیجیکالا خرید کنم  با تشکر 
0,اولش عالی بود ولی بعد چند ماه شکست با این قیمت اینو ازش توقع نداشتم 
0,ضمن احترام به نظرات دوستان دو توضیح برای امواج رادیویی لازم هست  یکی از دوستان گفته رادیو موج AM نداره  در جواب باید گفته موج AM همون موج MW هست  وصرفا در رادیوهای 2موج گفته میشود رادیو دارای دو موج هست AM و Fm  فقط گستره امواج AM کمی بیشتر از MW هست  یکی دیگه از دوستان گفته رادیو موج SW2 نداره در جواب باید گفت که امواج SW یا امواج کوتاه از 2 3 مگاهرتز شروع میشه و تا 22 مگاهرتز شروع میشه که این براساس شرکت سازنده تعریف وتقسیم بندی میشود این رادیو از فرکانس 5 مگاهرتز یا 49 متر تا 18 مگاهرتز یا 16 متر محدوده باند SW آن هست که بسیار وسیع می باشد  وعملا فرستنده های رادیویی امواج خود را در این محدوده پخش می کنند  بنابراین نیازی به sw2 نیست  
0,بسیار گوشی بیکیفت و ظریف و کند  هست اصلا راضی نیستم 
1,کیبوردش فارسی نداره و بایستی لیبل بچسبونید 
0,سلام لبتاب خوبیه  تواین رنج قیمت امکانات خوبی داره   من راضیم 
0,اگه کسی استفاده کرده لطفا بگه موقع پخش فیلم های Full HD 1080p صدا و تصویر تاخیر یا لگ نداره  
0,دوستان رنگش به زردى میزنه جالب نیست 
1,من این محصول رو رنگ استیلش رو خریدم خیلی عالیه ممنون از دیجیکالا اما باید صداش بیشتر می بود و بیسش بالاتر و جذابتر با این قیمت حتما میشه محصولی با کیفیت بهتر پیدا کرد اما از خریدم پشیمون نیستم 
1,کیفیت دریچه بخار روی در که قابل باز و بسته شدن است پایین است  به طوری که هم لق است و هم کامل بسته نمی شود  اما کیفیت تابه قابل قبول است  
0,کلا معلومه تفلون اصل نیست کفش به راحتی خش میفته با این قیمت جنس های خیلی بهتر میشه از همینجا تهیه کرد 
1,درست بعد از یک سال و دوهفته باطریش مشکل پیدا کرد که نتونستم از گارانتیش واسه باطری استفاده کنم  
1,تبلت من بعد از سه روز بلا استفاده بودن دیگر روشن نشد  تمامی روشهای توصیه شده را هم امتحان کردم ولی روشن نشد  
1,یک ماهی که این لپتاب از دیجی خریدم  ولی حدود یک هفته پیش هاردش سوخت و بردم گارانتی بدون هزینه برام عوض کردن   یه لپتاب معمولی هست و باید واسه کاراهای ساده و سبک استفاده بشه 
0,من این محصول رو خریدم ولی اصلا راضی نیستم چون اصلا راحت نیست تو گوش و خیلی زود گوشو خسته میکنه واسه کسانی که مثل من  روزانه چندین ساعت ب موزیک گوش میدن اصلا خوب نیست  
1,نسبت به این قیمت خوبه اما کیفیت صفحه نمایش نامید کنندس 
1,سلام به همه دوستان من خودم پارسال تابستان ps4 خریده بودم و چون این پایه رو نداشتم مجبور بودم کنسول رو فقط به حالت افقی قرار بدم و دیگه از افقی بودن کنسول خسته شده بودم اگه هم کنسول رو بدون پایه به صورت عمودی بذارین احتمال افتادن و داغون شدن دستگاه وجود داره پس این پایه رو خریداری کردم و الان بدون هیچ نگرانی از افتادن دستگاه میتونم اون رو عمودی قرار بدم تازه اینجوری جای کمتری رو هم اشغال میکنه  
0,گارانتی دستگاه من هپ کن بود که اصلا پاسخگویی مناسبی ندارد 
1,با تکان دادن دستگاه صدا های متعددی ازش میاد  که انگار چیزهایی سر جاشون نیستند و با دو دستگاه دیگه هم تست کردم و مشکل همگانیه ظاهرا  و پنل پایینی هم درست فیکس نشده و دایم صداهای اسکوییکی میده این مورد هم نسبتا فراگیر ه  غیر این موارد واقعا عالیه 
0,ما سال پیش یکی از اینها رو خریدیم لوله خرطومیش براثر قرار گرفتن در مجاورت اطو سوراخ شد   وقنی به نمایندگیش مراجعه کردیم گفت لوله خرطومی جاروبرقی هایی که کلید روشن و خاموش کردنشون روی دسته خرطومی هست  را ندارند و باید ببرین تعمیرگاه شاید بتوانند درستش کنند  در ضمن تعمیرگاهی که آدرس دادن در چهارراه امین ظهور  تهران   هست که اگر بخواهی ببری حداقل یک روز باید از کاروزندگی بیافتی 
1,دوستان همه چی خوبه  هم جنس عالی و راحتیش و سادگیش خوبه    ولی توجه کنید پیچی نیست و ممکنه در اثر سنگینی   بخصوص نمک   باز بشه و بریزه   البته من با پیچیدن یه کم نوار تفلون مشکلم حل شد  
1,خیلی خوبه من که ازش راضی ام   کیفیت خبی هم داره دوربینش   
0,چرا ننوشتین چند گرم هست  
0,سلام خدمت دوستان خریدار بنده بعد از 1سال و 8 ماه استفاده از این هندزفری دارم نظرم را میدهم  کیفیت پخش هندزفری خیلی خوب است و بیس قوی دارد ولی چون هندزفری از پشت بسته است گوش دادن زیاد موسیقی سردرد می آورد و خسته میشوید  نقطه ی ضعف دیگر این هندزفری کیفیت سیم آن است گه در ابتدا خوب جلوه میکند ولی به مرور استفاده و قرار گرفتن در آفتاب حالت نرم و چسبناک می گیرد  و یکی از گوشی های هندفری بعد از یکسال و نیم اسفاده از کار افتاد  خلاصه این هندفری به اندازه قیمتش کار نکرد ا 
0,کیفیت دسته و گوشی ها بسیار پایین است  در نگاه اول جنس پلاستیکی گوشی ها به شدت جلب توجه می کند  نکته دیگر خروج بیش از حد صدا از گوشی هاست  حتی اگر موزیک با صدای معمولی گوش کنید اطرافیان به راحتی می شنوند و اکثرا مزاحمشان است  با توجه به این قیمت انتظار خیلی بیشتری داشتم و خرید این محصول را به هیچ وجه پیشنهاد نمیکنم 
0,سلام من این اتو را حدود دو ماهه خریدم و قبلا اتو کلویناتور داشته ایم  مشکل اصلی سخت اتو کردن لباس است انگار که لباس به کف اتو چسبیده در ثانی در درجه حرارت کم  نایلون  اتو اصلا بخار نمیدهد و شما باید درجه آن را زیاد کنید که برای بعضی لباسها خوب نیست ثالثا بر خلاف تبلیغات روی جلد اتو  اتوکشی آسان  اصلا بدرد اتوکشی نمی خورد و من شدیدا از خرید آن پشیمان هستم اگر می خواهید پولتان را بیرون بریزید این اتو را بخرید 
1,چاپگر خوبیه ولی هزینه شارژ کاتریجاش خیلی بالاس یعنی هر بار باید 200هزار برای شارژ بذارید کنار 
0,نسبت به قیمتش کیفیت لازم رو نداره یعنی برق معمولی و ضعیفی داره و خیلی خیره کننده و زیبا نیست ماندگاریشم بالا نیست و بعد از 20 دقیقه دیگه اثری ازش نیست خلاصه نمیشه بهش گفت هایلایتر خوب   
1,من برای کارای دانشجویی و سبک گرفتم کیفیت ساخت خیلی عالی داره و اندازه اش کاملاً مناسب برای استفاده  شارژ باتری از صفر تا صد تقریباً 3 5 ساعت طول میکشه ولی بعدش در استفاده روتین براحتی 8 ساعت میره که خوبه من بدون کاور تایپ استفاده می کنم و خیلی راحته  فقط اگه قلم اش باهاش بود خیلی خوب میشد   اگه برای استفاده روتین مثل وبگردی و آفیس و فیلم و  میخواید بهترین انتخاب تو سرفیس هاست بیخودی پولتونو برای نسخه پرو هدر ندین فقط کمتر از 64 نگیرید که با مشکل جدی کمبود حافظه مواجه میشین  تشکر از دیجی بخاطر تحویل بدون نقص اش  
0,با سلام خدمت همه دوستان چمد وقت پیش این پرینتر رو خریدم 
0,لنوو قطعات و خدماتش تو ایران ضعیف و هر کس یه چیزی میگه در کل من که یک لپ تاپ و یک تب لت ازش خریدم جفتش زود خراب شد و خدمات پس از فروشش فوق العاده افتضاح یک مدت دستگاه نگه میدارند بعد زنگ میزنن میگن قطعه پیدا نشده بیا ببرش فکر کنم چند تا قطعه داخلشم بر میدارن توش کهنه رو میبندن در کل دوستان من که راضی نبودم امیدوارم برای شما همچین چیزی پیش نیاد  
1,سلام به دوستان عزیز این تی وی رو دیروز 23 تیر تحویل گرفتم و می خوام با سونی 4k عوضش کنم چون تا الان فقط از سونی استفاده میکردم و از کیفیت تصویر این تی وی راضی نیستم و قسمت های تیره تصاویر رو خوب نشون نمیده 
